,main_headings,main_contents,video_headings,video_urls,sub_headings_h2,sub_headings_h3,image_urls,facts,definitions,explanations,snippets,codes,outputs,table_data,list_items
6,['C# Basic Input and Output'],"['In this tutorial, we will learn how to take input from user and and display output in C# using various methods']",[],[],"['C# Output', 'C# Input']","['Example 1: Printing String using WriteLine()', 'Difference between WriteLine() and Write() method', 'Printing Variables and Literals using WriteLine() and Write()', 'Combining (Concatenating) two strings using + operator and printing them', 'Printing concatenated string using Formatted String [Better Alternative]', 'Example 6: Get String Input From User', 'Difference between ReadLine(), Read() and ReadKey() method:', 'Reading numeric values (integer and floating point types)']",[],"['In order to output something in C#, we can use', 'When we run the program, the output will be', 'When we run the program, the output will be', 'When we run the program, the output will be', 'When we run the program, the output will be', 'The following line,', 'can be replaced by,', 'When we run the program, the output will be', 'To know more about string formatting, visit C# string formatting.', 'When we run the program, the output will be:', 'When we run the program, the output will be', 'When we run the program, the output will be']","['Here, System is a namespace, Console is a class within namespace System and WriteLine and Write are methods of class Console.', ""Let's look at a simple example that prints a string to output screen."", ""Let's take at a look at the example below to understand the difference between these methods."", ""The WriteLine() and Write() method can be used to print variables and literals. Here's an example."", 'Strings can be combined/concatenated using the + operator while printing.', 'Multiple variables can be used in the formatted string. We will see that in the example below.', 'The difference between ReadLine(), Read() and ReadKey() method is:', 'Reading a character or string is very simple in C#. All you need to do is call the corresponding methods as required.', 'One simple approach for converting our input is using the methods of Convert class.', 'There are other ways to get numeric inputs from user. To learn more, visit Reading an integer from user input.']","['The main difference between WriteLine() and Write() is that the Write() method only prints the string provided to it, while the WriteLine() method prints the string and moves to the start of next line as well.', 'A better alternative for printing concatenated string is using formatted string. Formatted string allows programmer to use placeholders for variables. For example,', '{0} is the placeholder for variable val which will be replaced by value of val. Since only one variable is used so there is only one placeholder.', 'Here, {0} is replaced by firstNumber, {1} is replaced by secondNumber and {2} is replaced by result. This approach of printing output is more readable and less error prone than using + operator.', 'In C#, the simplest method to get input from the user is by using the ReadLine() method of the Console class. However, Read() and ReadKey() are also available for getting input from the user. They are also included in Console class.', 'If you want to know more about these methods, here is an interesting discussion on StackOverflow on: Difference between Console.Read() and Console.ReadLine()?.', 'From this example, it must be clear how ReadKey() and Read() method works. While using ReadKey(), as soon as the key is pressed, it is displayed on the screen.', 'When Read() is used, it takes a whole line but only returns the ASCII value of first character. Hence, 76\xa0(ASCII value of L) is printed.', 'But, reading numeric values can be slightly tricky in C#. We’ll still use the same ReadLine() method we used for getting string values. But since the ReadLine() method receives the input as string, it needs to be converted into integer or floating point type.', 'The ToInt32() and ToDouble() method of Convert class converts the string input to integer and double type respectively. Similarly we can convert the input to other types. Here is a complete list of available methods for Convert class.']","['using System;', 'namespace Sample', '\tclass Test', 'using System;', 'namespace Sample', '\tclass Test', '\t\t\tConsole.Write(""Same line"");', 'using System;', 'namespace Sample', '\tclass Test', '\t\t\tint value = 10;', '\t\t\tConsole.WriteLine(value);', '\t\t\tConsole.WriteLine(50.05);', 'using System;', 'namespace Sample', '\tclass Test', '\t\t\tint val = 55;', 'using System;', 'namespace Sample', '\tclass Test', 'using System;', 'namespace Sample', '\tclass Test', '\t\t\tstring testString;', 'using System;', 'namespace Sample', '\tclass Test', '\t\t\tint userInput;', '\t\t\tConsole.ReadKey();', '\t\t\tConsole.WriteLine();', '\t\t\tuserInput = Console.Read();', 'using System;', 'namespace UserInput', '\tclass MyClass', '\t\t\tstring userInput;', '\t\t\tint intVal;', '\t\t\tdouble doubleVal;']","['\t\tpublic static void Main(string[] args)', '\t\t\tConsole.WriteLine(""C# is cool"");', '\t\tpublic static void Main(string[] args)', '\t\t\tConsole.WriteLine(""Prints on "");', '\t\t\tConsole.WriteLine(""New line"");', '\t\tpublic static void Main(string[] args)', '\t\tpublic static void Main(string[] args)', '\t\t\tConsole.WriteLine(""Hello "" + ""World"");', '\t\t\tConsole.WriteLine(""Value = "" + val);', '\t\tpublic static void Main(string[] args)', '\t\t\tint firstNumber = 5, secondNumber = 10, result;', '\t\t\tresult = firstNumber + secondNumber;', '\t\t\tConsole.WriteLine(""{0} + {1} = {2}"", firstNumber, secondNumber, result);', '\t\tpublic static void Main(string[] args)', '\t\t\tConsole.Write(""Enter a string - "");', '\t\t\ttestString = Console.ReadLine();', '\t\t\tConsole.WriteLine(""You entered \'{0}\'"", testString);', '\t\tpublic static void Main(string[] args)', '\t\t\tConsole.WriteLine(""Press any key to continue..."");', '\t\t\tConsole.Write(""Input using Read() - "");', '\t\t\tConsole.WriteLine(""Ascii Value = {0}"",userInput);', '\t\tpublic static void Main(string[] args)', '\t\t\tConsole.Write(""Enter integer value: "");', '\t\t\tuserInput = Console.ReadLine();', '\t\t\t/* Converts to integer type */', '\t\t\tintVal = Convert.ToInt32(userInput);', '\t\t\tConsole.WriteLine(""You entered {0}"",intVal);', '\t\t\tConsole.Write(""Enter double value: "");', '\t\t\tuserInput = Console.ReadLine();', '\t\t\t/* Converts to double type */', '\t\t\tdoubleVal = Convert.ToDouble(userInput);', '\t\t\tConsole.WriteLine(""You entered {0}"",doubleVal);']","['System.Console.WriteLine() OR', 'System.Console.Write()', 'C# is cool', 'Prints on', 'New line', 'Prints on Same line', '10', '50.05', 'Hello World', 'Value = 55', 'Console.WriteLine(""Value = "" + val);', 'Console.WriteLine(""Value = {0}"", val);', '5 + 10 = 15', 'Enter a string - Hello World', ""You entered 'Hello World'"", 'Press any key to continue...', 'x', 'Input using Read() - Learning C#', 'Ascii Value = 76', 'Enter integer value: 101', 'You entered 101', 'Enter double value: 59.412', 'You entered 59.412']",[],['ReadLine(): The ReadLine() method reads the next line of input from the standard input stream. It returns the same string.|||Read(): The Read() method reads the next character from the standard input stream. It returns the ascii value of the character.|||ReadKey(): The ReadKey() method obtains the next key pressed by user. This method is usually used to hold the screen until user press a key.|||']
7,"['C# Expressions, Statements and Blocks (With Examples)']","['In this article, we will learn about C# expressions, C# statements, difference between expression and statement, and C# blocks.']",[],[],"['C# Expressions', 'C# Statements', 'C# Blocks', 'Example 1: C# Blocks with statements']","['Declaration Statement', 'Expression Statement', 'Example 2: C# Blocks without statements']",[],"[""Let's look at the example below:"", 'Here, a + b + c is an expression.', 'For example:', 'In the above example, both lines above are statements.', 'For example:', 'Both char ch; and int maxValue = 55; are declaration statements.', 'For example:', 'Beside declaration and expression statement, there are:', 'These statements will be discussed in later tutorials.', 'For example:', 'When we run the program, the output will be:', 'Here, the two statements inside { }:', 'forms a block.']","['Here, 42.05 is an expression. Also, temperature = 42.05 is an expression too.', 'Here, (age>=18 && age<58) is an expression that returns a boolean value. ""Eligible to work"" is also an expression.', 'A statement is a basic unit of execution of a program. A program consists of multiple statements.', 'There are different types of statements in C#. In this tutorial, we’ll mainly focus on two of them:', 'Declaration statements are used to declare and initialize variables.', 'An expression followed by a semicolon is called an expression statement.', 'Here, 3.14 * radius * radius \xa0is an expression and area = 3.14 * radius * radius; is an expression statement.', 'Likewise, System.Console.WriteLine(""Hello""); is both an expression and a statement.', 'If you want to learn more about statements, visit C# Statements ( C# reference)', 'A block is a combination of zero or more statements that is enclosed inside curly brackets { }.', 'A block may not have any statements within it as shown in the below example.', 'Here, the curly braces { } after if(temperature > 32) contains only comments and no statements.']","['Expressions, statements and blocks are the building block of a C# program. We have been using them since our first ""Hello World"" program.', 'An expression in C# is a combination of operands (variables, literals, method calls) and operators that can be evaluated to a single value. To be precise, an expression must have at least one operand but may not have any operator.']","['using System;', 'namespace Blocks', '\tclass BlockExample', '\t\t\tdouble temperature = 42.05;', '\t\t\tif (temperature > 32)', '\t\t\t{\t// Start of block', '\t\t\t}\t// End of block', 'using System;', 'namespace Blocks', '\tclass BlockExample', '\t\t\tdouble temperature = 42.05;', '\t\t\tif (temperature > 32)', '\t\t\t{\t// Start of block', '\t\t\t}\t// End of block']","['\t\tpublic static void Main(string[] args)', '\t\t\t\tConsole.WriteLine(""Current temperature = {0}"", temperature);', '\t\t\t\tConsole.WriteLine(""It\'s hot"");', '\t\tpublic static void Main(string[] args)']","['double temperature;', 'temperature = 42.05;', 'int a, b, c, sum;', 'sum = a + b + c;', 'if (age>=18 && age<58)', '\tConsole.WriteLine(""Eligible to work"");', 'int age = 21;', 'Int marks = 90;', 'char ch;', 'int maxValue = 55;', '/* Assignment */', 'area = 3.14 * radius * radius;', '/* Method call is an expression*/', 'System.Console.WriteLine(""Hello"");', 'Current temperature = 42.05', ""It's hot"", 'Console.WriteLine(""Current temperature = {0}"", temperature);', 'Console.WriteLine(""It\'s hot"");']",[],"['Selection Statements (if...else, switch)|||Iteration Statements (do, while, for, foreach)|||Jump Statements (break, continue, goto, return, yield)|||Exception Handling Statements (throw, try-catch, try-finally, try-catch-finally)|||&&&Declaration Statement|||Expression Statement|||']"
8,['C# Comments'],"['In this article, we will learn about C# comments, different style of comments, and why and how to use them in a program.']",[],[],"['Single Line Comments', 'Multi Line Comments', 'XML Documentation Comments', 'Use Comments the Right Way']","['Example 1: Using single line comment', 'Example 2: Using multi line comment', 'Example 3: Using XML documentation comment']",[],"['In C#, there are 3 types of comments:', 'Here, Adding 5 and 7 is the comment.', 'The above program contains 3 single line comments:', 'The above program contains 2 multi line comments:', 'If you are not familiar with XML, see What is XML?', 'The XML comment used in the above program is', 'The XML documentation (.xml file) generated will contain:', 'For example:']","['Multi line comments start with /* and ends with */. Multi line comments can span over multiple lines.', 'Visit XML Documentation Comments if you are interested in learning more.', 'Comments are used to explain parts of code but they should not be overused .']","['Comments are used in a program to help us understand a piece of code. They are human readable words intended to make the code readable. Comments are completely ignored by the compiler.', 'Single line comments start with a double slash //. The compiler ignores everything after // to the end of the line. For example,', 'Single line comments can be written in a separate line or along with the codes in same line. However, it is recommended to use comments in a separate line.', 'Here, we may have noticed that it is not compulsory for a multi line comment to span over multiple lines. /* … */ can be used instead of single line comments.', 'XML documentation comment is a special feature in C#. It starts with a triple slash /// and is used to categorically describe a piece of code.. This is done using XML tags within a comment. These comments are then, used to create a separate XML documentation file.', 'Using comment in the above example is not necessary. It is obvious that the line will print Hello World. Comments should be avoided in such cases.']","['using System;', 'namespace HelloWorld', '\tclass Program', 'using System;', 'namespace HelloWorld', '\tclass Program', 'using System;', 'namespace HelloWorld', '\tclass Program']","['\t\tpublic static void Main(string[] args)  // Execution Starts from Main method', '\t\t\tConsole.WriteLine(""Hello World!"");', '\tThis is a Hello World Program in C#.', '\tThis program prints Hello World.', '\t\tpublic static void Main(string[] args)', '\t\t\tConsole.WriteLine(""Hello World!"");', '\t\tpublic static void Main(string[] args)', '\t\t\tConsole.WriteLine(""Hello World!"");']","['int a = 5 + 7; // Adding 5 and 7', '/*', 'This is a Hello World Program in C#.', 'This program prints Hello World.', '*/', '/* Prints Hello World */', '<?xml version=""1.0""?>', '<doc>', '\t<assembly>', '\t\t<name>HelloWorld</name>', '\t</assembly>', '\t<members>', '\t</members>', '</doc>', 'Console.WriteLine(""Hello World"");']",[],"['Instead comments should be used in the program to explain complex algorithms and techniques.|||Comments should be short and to the point instead of a long description.|||As a rule of thumb, it is better to explain why instead of how, using comments.|||&&&Single Line Comments ( // )|||Multi Line Comments (/* */)|||XML Comments ( /// )|||']"
9,"['C# if, if...else, if...else if and Nested if Statement']","['In this article, we will learn how to use if, if...else, if...else if statement in C# to control the flow of our program’s execution.']",[],[],"['C# if (if-then) Statement', 'C# if...else (if-then-else) Statement', 'C# if...else if (if-then-else if) Statement', 'Nested if...else Statement']","['How if statement works?', 'Example 1: C# if Statement', 'How if...else Statement works?', 'Example 2: C# if...else Statement', 'Example 3: C# if...else if Statement', 'Example 4: Nested if...else Statement']","['//cdn.programiz.com/sites/tutorial2program/files/if-statement-csharp.png', '//cdn.programiz.com/sites/tutorial2program/files/if-else-statement-csharp.png']","['For example,', 'In this example, the statement', 'will be executed only if the value of number is less than 5.', 'Remember the += operator?', 'When we run the program, the output will be:', 'The syntax of if...else statement in C# is:', 'For example,', 'In this example, the statement', 'will be executed only if the value of number is less than 5.', 'The statement', 'When we run the program, the output will be:', 'Alternatively, we can use switch statement in such condition.', 'When we run the program, the output will be:', 'The general structure of nested if…else statement is:', 'When we run the program, the output will be:']","[""In this article, we'll learn to test conditions using if statement in C#."", 'C# if-then statement will execute a block of code if the given condition is true. The syntax of if-then statement in C# is:', 'Now, change the value of number to something greater than 5, say 10. When we run the program the output will be:', ""The expression number < 5 will return false, hence the code inside if block won't be executed."", 'will be executed if the value of number is greater than or equal to 5.', 'Now, change the value of number to something less than 5, say 2. When we run the program the output will be:', 'The expression number < 5 will return true, hence the code inside if block will be executed.', 'Ternary operator in C# provides a shortcut for C# if...else statement.', 'For such case, we can use if..else if statement in C#. The syntax for if...else if statement is:', 'If none of the expression is true, the code inside the else block is executed.', 'Similarly, we can change the value of number to alter the flow of execution.', 'An if...else statement can exist within another if...else statement. Such statements are called nested if...else statement.', 'The following program computes the largest number among 3 numbers using nested if...else statement.']","[""Testing a condition is inevitable in programming. We will often face situations where we need to test conditions (whether it is true or false) to control the flow of program. These conditions may be affected by user's input, time factor, current environment where the program is running, etc."", 'The value of number is initialized to 2. So the expression number < 5 is evaluated to true. Hence, the code inside the if block are executed. The code after the if statement will always be executed irrespective to the expression.', 'The if statement in C# may have an optional else statement. The block of code inside the else statement will be executed if the expression is evaluated to false.', 'Here, the value of number is initialized to 12. So the expression number < 5 is evaluated to false. Hence, the code inside the else block are executed. The code after the if..else statement will always be executed irrespective to the expression.', 'When we have only one condition to test, if-then and if-then-else statement works fine. But what if we have a multiple condition to test and execute one of the many block of code.', 'The if...else if statement is executed from the top to bottom. As soon as a test expression is true, the code inside of that if ( or else if ) block is executed. Then the control jumps out of the if...else if block.', 'The value of number is initialized to 12. The first test expression number < 5 is false, so the control will move to the else if block. The test expression number > 5 is true hence the block of code inside else if will be executed.', 'Nested if statements are generally used when we have to test one condition followed by another. In a nested if statement, if the outer if statement returns true, it enters the body to check the inner if statement.']","['using System;', 'namespace Conditional', '\tclass IfStatement', '\t\t\tint number = 2;', '\t\t\tif (number < 5)', 'using System;', 'namespace Conditional', '\tclass IfElseStatement', '\t\t\tint number = 12;', '\t\t\tif (number < 5)', 'using System;', 'namespace Conditional', '\tclass IfElseIfStatement', '\t\t\tint number = 12;', '\t\t\tif (number < 5)', '\t\t\telse if (number > 5)', 'using System;', 'namespace Conditional', '\tclass Nested', '\t\t\tif (first > second)', '\t\t\t\tif (firstNumber > third)', '\t\t\t\telse', '\t\t\t\tif (second > third)', '\t\t\t\telse']","['\t\tpublic static void Main(string[] args)', '\t\t\t\tConsole.WriteLine(""{0} is less than 5"", number);', '\t\t\tConsole.WriteLine(""This statement is always executed."");', '\t\tpublic static void Main(string[] args)', '\t\t\t\tConsole.WriteLine(""{0} is less than 5"", number);', '\t\t\t\tConsole.WriteLine(""{0} is greater than or equal to 5"", number);', '\t\t\tConsole.WriteLine(""This statement is always executed."");', '\t\tpublic static void Main(string[] args)', '\t\t\t\tConsole.WriteLine(""{0} is less than 5"", number);', '\t\t\t\tConsole.WriteLine(""{0} is greater than 5"", number);', '\t\t\t\tConsole.WriteLine(""{0} is equal to 5"");', '\t\tpublic static void Main(string[] args)', '\t\t\tint first = 7, second = -23, third = 13;', '\t\t\t\t\tConsole.WriteLine(""{0} is the largest"", first);', '\t\t\t\t\tConsole.WriteLine(""{0} is the largest"", third);', '\t\t\t\t\tConsole.WriteLine(""{0} is the largest"", second);', '\t\t\t\t\tConsole.WriteLine(""{0} is the largest"", third);']","['if (boolean-expression)', '{', '}', 'if (number < 5)', '{', '\tnumber += 5;', '}', 'number += 5;', '2 is less than 5', 'This statement is always executed.', 'This statement is always executed.', 'if (boolean-expression)', '{', '}', 'else', '{', '}', 'if (number < 5)', '{', '\tnumber += 5;', '}', 'else', '{', '\tnumber -= 5;', '}', 'number += 5;', 'number -= 5;', '12 is greater than or equal to 5', 'This statement is always executed.', '2 is less than 5', 'This statement is always executed.', 'if (boolean-expression-1)', '{', '}', 'else if (boolean-expression-2)', '{', '}', 'else if (boolean-expression-3)', '{', '}', '.', '.', '.', 'else', '{', '}', '12 is greater than 5', 'if (boolean-expression)', '{', '\tif (nested-expression-1)', '\t{', '\t}', '\telse', '\t{', '\t}', '}', 'else', '{', '\tif (nested-expression-2)', '\t{', '\t}', '\telse', '\t{', '\t}', '}', '13 is the largest']",[],"['The boolean-expression will return either true or false.|||If the boolean-expression returns true, the statements inside the body of if ( inside {...} ) will be executed.|||If the boolean-expression returns false, the statements inside the body of if will be ignored.|||']"
