,main_headings,main_contents,video_headings,video_urls,sub_headings_h2,sub_headings_h3,image_urls,facts,definitions,explanations,snippets,codes,outputs,table_data,list_items
0,['C# Hello World - Your First C# Program'],"['In this tutorial, we will learn how to write a simple ""Hello World!"" program in C#. This will get you familiar with the basic syntax and requirements of a C# program.']",[],[],"['""Hello World!"" in C#', 'How the ""Hello World!"" program in C# works?', 'Alternative Hello World! implementation', 'Things to remember from this article']",[],[],"['When you run the program, the output will be:', ""Let's break down the program line by line."", 'Here’s an alternative way to write the “Hello World!” program.']","['The purpose of this program is to get us familiar with the basic syntax and requirements of a programming language.', 'Notice in this case, we’ve written using System; at the start of the program. By using this, we can now replace', 'This is a convenience we’ll be using in our later chapters as well.']","['The “Hello World!” program is often the first program we see when we dive into a new language. It simply prints Hello World! on the output screen.', ""This is just a simple program for introducing C# to a newbie. If you did not understand certain things in this article, that's okay (even I did not when I started). As we move on with this tutorial series, everything will start to make sense.""]","['namespace HelloWorld', '    class Hello {         ', '        {', '        }', 'using System;', 'namespace HelloWorld', '    class Hello {         ', '        {', '        }']","['        static void Main(string[] args)', '            System.Console.WriteLine(""Hello World!"");', '        static void Main(string[] args)', '            Console.WriteLine(""Hello World!"");']","['Hello World!', 'System.Console.WriteLine(""Hello World!"");', 'Console.WriteLine(""Hello World!"");']",[],"['Every C# program must have a class definition.|||The execution of program begins from the Main() method.|||Main() method must be inside a class definition.|||&&&// Hello World! Program// indicates the beginning of a comment in C#. Comments are not executed by the C# compiler.|||They are intended for the developers to better understand a piece of code. To learn more about comments in C#, visit C# comments.|||\xa0|||namespace HelloWorld{...}|||The namespace keyword is used to define our own namespace. Here we are creating a namespace called HelloWorld.|||Just think of namespace as a container which consists of classes, methods and other namespaces. To get a detailed overview of namespaces, visit C# Namespaces.|||\xa0|||class Hello{...}|||The above statement creates a class named - Hello in C#. Since, C# is an object-oriented programming language, creating a class is mandatory for the program’s execution.|||\xa0|||static void Main(string[] args){...}Main() is a method of class Hello. The execution of every C# program starts from the Main() method. So it is mandatory for a C# program to have a Main() method.|||The signature/syntax of the Main() method is:||||||static void Main(string[] args)|||{|||    ...|||}|||We’ll learn more about methods in the later chapters.|||\xa0|||System.Console.WriteLine(""Hello World!"");|||For now, just remember that this is the piece of code that prints Hello World! to the output screen.You’ll learn more about how it works in the later chapters.|||']"
1,['C# Keywords and Identifiers'],"['In this tutorial, we will learn about keywords (reserved words) and identifiers in C# programming language.']",[],[],"['C# Keywords', 'C# Identifiers', 'Rules for Naming an Identifier', 'Example: Find list of keywords and identifiers in a program']",['Contextual Keywords'],[],"['For example,', 'The above statement will create a variable @void of type int.', 'This statement will generate an error in compile time.', 'To learn more about variables, visit C# Variables.', 'Here are some of the valid and invalid identifiers:', 'The ""Hello World!"" inside WriteLine method is a string literal.']","['Also, keywords like long, int, char, etc can not be used as identifiers. So, we cannot have something like:', 'C# has a total of 79 keywords. All these keywords are in lowercase. Here is a complete list of all C# keywords.', 'Although keywords are reserved words, they can be used as identifiers if @ is added as prefix. For example,', 'If you are interested to know the function of every keywords, I suggest you visit C# keywords (official C# docs).', ""Just to clear the concept, let's find the list of keywords and identifiers in the program we wrote in C# Hello World.""]","['Keywords are predefined sets of reserved words that have special meaning in a program. The meaning of keywords can not be changed, neither can they be directly used as identifiers in a program.', 'Here, long is a keyword and mobileNum is a variable (identifier). long has a special meaning in C# i.e. it is used to declare variables of type long and this function cannot be changed.', 'Besides regular keywords, C# has 25 contextual keywords. Contextual keywords have specific meaning in a limited program context and can be used as identifiers outside that context. They are not reserved words in C#.', 'Identifiers are the name given to entities such as variables, methods, classes, etc. They are tokens in a program which uniquely identify an element. For example,', 'Here, value is the name of variable. Hence it is an identifier. Reserved keywords can not be used as identifiers unless @ is added as prefix. For example,']","['using System;', 'namespace HelloWorld', '    class Hello', '{         ', '        {', '        }']","['        static void Main(string[] args)', '          Console.WriteLine(""Hello World!"");']","['long mobileNum;', 'long long;', 'int @void;', 'int value;', 'int break;']","['bstract|||as|||base|||bool&&&reak|||byte|||case|||catch&&&har|||checked|||class|||const&&&ontinue|||decimal|||default|||delegate&&&o|||double|||else|||enum&&&vent|||explicit|||extern|||false&&&inally|||fixed|||float|||for&&&oreach|||goto|||if|||implicit&&&n|||in (generic modifier)|||int|||interface&&&nternal|||is|||lock|||long&&&amespace|||new|||null|||object&&&perator|||out|||out (generic modifier)|||override&&&arams|||private|||protected|||public&&&eadonly|||ref|||return|||sbyte&&&ealed|||short|||sizeof|||stackalloc&&&tatic|||string|||struct|||switch&&&his|||throw|||true|||try&&&ypeof|||uint|||ulong|||unchecked&&&nsafe|||ushort|||using|||using static&&&oid|||volatile|||while|||\xa0', 'dd|||alias|||ascending&&&sync|||await|||descending&&&ynamic|||from|||get&&&lobal|||group|||into&&&oin|||let|||orderby&&&artial (type)|||partial (method)|||remove&&&elect|||set|||value&&&ar|||when (filter condition)|||where (generic type constraint)&&&ield|||\xa0|||\xa0', 'dentifiers|||Remarks&&&umber|||Valid&&&alculateMarks|||Valid&&&ello$|||Invalid (Contains $)&&&ame1|||Valid&&&if|||Valid (Keyword with prefix @)&&&f|||Invalid (C# Keyword)&&&y name|||Invalid (Contains whitespace)&&&hello_hi|||Valid', 'eywords|||Identifiers&&&sing|||System&&&amespace|||HelloWorld (namespace)&&&lass|||Hello (class)&&&tatic|||Main (method)&&&oid|||args&&&tring|||Console&&&|||WriteLine']","['An identifier can not be a C# keyword.|||An identifier must begin with a letter, an underscore or @ symbol. The remaining part of identifier can contain letters, digits and underscore symbol.|||Whitespaces are not allowed. Neither it can have symbols other than letter, digits and underscore.|||Identifiers are case-sensitive. So, getName, GetName and getname represents 3 different identifiers.|||']"
2,['C# Variables and (Primitive) Data Types'],"['In this tutorial, we will learn about variables, how to create variables in C# and different data types that C# programming language supports.']",[],[],"['How to declare variables in C#?', 'Rules for Naming Variables in C#', 'Best Practices for Naming a Variable', 'C# Primitive Data Types', 'C# Literals']","['Implicitly typed variables', 'Boolean (bool)', 'Signed Integral', 'Unsigned Integral', 'Floating Point', 'Character (char)', 'Decimal', 'Boolean Literals', 'Integer Literals', 'Floating Point Literals', 'Character and String Literals']",[],"[""Here's an example to declare a variable in C#."", 'Here, the value of age is changed to 35 from 24.', 'For now remember,we can not do the following in C#:', 'You can learn more about implicitly typed local variables.', 'You can learn more about naming conventions in C# here.', 'For Example:', 'When we run the program, the output will be:', '1. sbyte', 'For example:', 'When we run the program, the output will be:', '2. short', 'For example:', 'When we run the program, the output will be:', '3. int', 'For example:', 'When we run the program, the output will be:', '4. long', 'For example:', 'When we run the program, the output will be:', '1. byte', 'For example:', 'When we run the program, the output will be:', '2. ushort', 'For example:', 'When we run the program, the output will be:', '3. uint', 'For example:', 'When we run the program, the output will be:', '4. ulong', 'For example:', 'When we run the program, the output will be:', '1. float', 'For example:', 'When we run the program, the output will be:', '2. double', 'For example:', 'When we run the program, the output will be:', 'For example: ', 'When we run the program, the output will be:', 'For example: ', 'When we run the program, the output will be:', ""Let's look at the following statement:"", 'Here,', 'For example:']","['A variable is a symbolic name given to a memory location. Variables are used to store data in a computer program.', 'In this example, a variable age of type int (integer) is declared and it can only store integer values.', 'We can assign a value to the variable later in our program like such:', 'However, the variable can also be initialized to some value during declaration. For example,', 'Here, a variable age of type int is declared and initialized to 24 at the same time.', 'Since, it’s a variable, we can change the value of variables as well. For example,', 'Variables declared using var keyword must be initialized at the time of declaration.', 'There are certain rules we need to follow while naming a variable. The rules for naming a variable in C# are:', ""Don't worry about public and private member variables. We will learn about them in later chapters."", 'These data types hold integer values (both positive and negative). Out of the total available bits, one bit is used for sign.', 'Try assigning values out of range i.e. less than -128 or greater than 127 and see what happens.', 'These data types hold floating point values i.e. numbers containing decimal values. For example, 12.36, -92.17, etc.', ""The unicode value of 'B' is '\\u0042', hence printing ch1 will print 'B'."", 'The suffix M or m must be added at the end otherwise the value will be treated as a double and an error will be generated.']","['Variables in C# must be declared before they can be used. This means, the name and type of variable must be known before they can be assigned a value. This is why C# is called a statically-typed language.', 'Once declared, the datatype of a variable can not be changed within a scope. A scope can be thought as a block of code where the variable is visible or available to use. If you don’t understand the previous statement, don’t worry we’ll learn about scopes in the later chapters.', 'Alternatively in C#, we can declare a variable without knowing its type using var keyword. Such variables are called implicitly typed local variables.', 'The compiler determines the type of variable from the value that is assigned to the variable. In the above example, value is of type int. This is equivalent to:', 'Variables in C# are broadly classified into two types: Value types and Reference types. In this tutorial we will be discussing about primitive (simple) data types which is a subclass of Value types.', 'Reference types will be covered in later tutorials. However, if you want to know more about variable types, visit C# Types and variables (official C# docs).', ""These data types only hold values equal to or greater than 0. We generally use these data types to store values when we are sure, we won't have negative values."", ""Literals are fixed values that appear in the program. They do not require any computation. For example, 5, false, 'w' are literals that appear in a program directly without any computation.""]","['using System;', 'namespace DataType', '    class BooleanExample', '        {', '        }', 'using System;', 'namespace DataType', '    class SByteExample', '        {', '            sbyte level = 23;', '        }', 'using System;', 'namespace DataType', '    class ShortExample', '        {', '        }', 'using System;', 'namespace DataType', '    class IntExample', '        {', '            int score = 51092;', '        }', 'using System;', 'namespace DataType', '    class LongExample', '        {', '        }', 'using System;', 'namespace DataType', '    class ByteExample', '        {', '            byte age = 62;', '        }', 'using System;', 'namespace DataType', '    class UShortExample', '        {', '        }', 'using System;', 'namespace DataType', '    class UIntExample', '        {', '        }', 'using System;', 'namespace DataType', '    class ULongExample', '        {', '        }', 'using System;', 'namespace DataType', '    class FloatExample', '        {', '        }', 'using System;', 'namespace DataType', '    class DoubleExample', '        {', '        }', 'using System;', 'namespace DataType', '    class CharExample', '        {', ""            char ch2 = 'x';"", '        }', 'using System;', 'namespace DataType', '    class DecimalExample', '        {', '        }']","['        public static void Main(string[] args)', '            bool isValid = true;', '            Console.WriteLine(isValid);', '        public static void Main(string[] args)', '            Console.WriteLine(level);', '        public static void Main(string[] args)', '            short value = -1109;', '            Console.WriteLine(value);', '        public static void Main(string[] args)', '            Console.WriteLine(score);', '        public static void Main(string[] args)', '            long range = -7091821871L;', '            Console.WriteLine(range);', '        public static void Main(string[] args)', '            Console.WriteLine(level);', '        public static void Main(string[] args)', '            ushort value = 42019;', '            Console.WriteLine(value);', '        public static void Main(string[] args)', '            uint totalScore = 1151092;', '            Console.WriteLine(totalScore);', '        public static void Main(string[] args)', '            ulong range = 17091821871L;', '            Console.WriteLine(range);', '        public static void Main(string[] args)', '            float number = 43.27F;', '            Console.WriteLine(number);', '        public static void Main(string[] args)', '            double value = -11092.53D;', '            Console.WriteLine(value);', '        public static void Main(string[] args)', '            Console.WriteLine(ch1);', '            Console.WriteLine(ch2);', '        public static void Main(string[] args)', '         decimal bankBalance = 53005.25M;', '            Console.WriteLine(bankBalance);']","['int age;', 'int age;', '... ... ...', 'age = 24;', 'int age = 24;', 'int age = 24;', 'age = 35;', 'int age;', 'age = 24;', '... ... ...', 'float age;', 'var value = 5;', 'int value;', 'value = 5;', 'True', '23', '-1109', '51092', '-7091821871', '62', '42019', '1151092', '17091821871', '43.27', '-11092.53', 'B', 'x', '53005.25', 'int number = 41;', 'bool isValid = true;', 'bool isPresent = false;', 'long value1 = 4200910L;', 'long value2 = -10928190L;', 'int decimalValue = 25;', 'int hexValue = 0x11c;// decimal value 284', 'double number = 24.67;// double by default', 'float value = -12.29F;', 'double scientificNotation = 6.21e2;// equivalent to 6.21 x 102 i.e. 621', ""char ch1 = 'R';// character"", ""char ch2 = '\\x0072';// hexadecimal"", ""char ch3 = '\\u0059';// unicode"", 'char ch4 = (char)107;// casted from integer', 'string firstName = ""Richard"";', 'string lastName = "" Feynman"";']","['ariable Names|||Remarks&&&ame|||Valid&&&ubject101|||Valid&&&age|||Valid (Best practice for naming private member variables)&&&break|||Valid (Used if name is a reserved keyword)&&&01subject|||Invalid (Starts with digit)&&&our_name|||Valid&&&our name|||Invalid (Contains whitespace)', 'haracter|||Meaning&&&\'|||Single quote&&&""|||Double quote&&&\\|||Backslash&&&n|||Newline&&&r|||Carriage return&&&t|||Horizontal Tab&&&a|||Alert&&&b|||Backspace']","['Boolean data type has two possible values: true or false|||Default value: false|||Boolean variables are generally used to check conditions such as in if statements, loops, etc.|||Size: 8 bits|||Range: -128 to 127.|||Default value: 0|||Size: 16 bits|||Range: -32,768 to 32,767|||Default value: 0|||Size: 32 bits|||Range: -231 to 231-1|||Default value: 0|||Size: 64 bits|||Range: -263 to 263-1|||Default value: 0L [L at the end represent the value is of long type]|||Size: 8 bits|||Range: 0 to 255.|||Default value: 0|||Size: 16 bits|||Range: 0 to 65,535|||Default value: 0|||Size: 32 bits|||Range: 0 to 232-1|||Default value: 0|||Size: 64 bits|||Range: 0 to 264-1|||Default value: 0|||Single-precision floating point type|||Size: 32 bits|||Range: 1.5 × 10−45 to 3.4 × 1038|||Default value: 0.0F [F at the end represent the value is of float type]|||Double-precision floating point type. What is the difference between single and double precision floating point?|||Size: 64 bits|||Range: 5.0 × 10−324 to 1.7 × 10308|||Default value: 0.0D [D at the end represent the value is of double type]|||It represents a 16 bit unicode character.|||Size: 16 bits|||Default value: \'\\0\'|||Range: U+0000 (\'\\u0000\') to U+FFFF (\'\\uffff\')|||Decimal type has more precision and a smaller range as compared to floating point types (double and float). So it is appropriate for monetary calculations.|||Size: 128 bits|||Default value: 0.0M [M at the end represent the value is of decimal type]|||Range: (-7.9 x 1028 to 7.9 x 1028) / (100 to 28)|||int is a data type|||number is a variable and|||41 is a literal|||true and false are the available boolean literals.|||They are used to initialize boolean variables.|||Integer literals are used to initialize variables of integer data types i.e. sbyte, short, int, long, byte, ushort, uint and ulong.|||If an integer literal ends with L or l, it is of type long. For best practice use L (not l).||||||long value1 = 4200910L;|||long value2 = -10928190L;||||||If an integer literal starts with a 0x, it represents hexadecimal value. Number with no prefixes are treated as decimal value. Octal and binary representation are not allowed in C#.||||||int decimalValue = 25;|||int hexValue = 0x11c;// decimal value 284||||||Floating point literals are used to initialize variables of float and double data types.|||If a floating point literal ends with a suffix f or F, it is of type float. Similarly, if it ends with d or D, it is of type double. If neither of the suffix is present, it is of type double by default.|||These literals contains e or E when expressed in scientific notation.||||||double number = 24.67;// double by default|||float value = -12.29F;|||double scientificNotation = 6.21e2;// equivalent to 6.21 x 102 i.e. 621||||||Character literals are used to initialize variables of char data types.|||Character literals are enclosed in single quotes. For example, \'x\', \'p\', etc.|||They can be represented as character, hexadecimal escape sequence, unicode representation or integral values casted to char.||||||char ch1 = \'R\';// character|||char ch2 = \'\\x0072\';// hexadecimal|||char ch3 = \'\\u0059\';// unicode|||char ch4 = (char)107;// casted from integer||||||String literals are the collection of character literals.|||They are enclosed in double quotes. For example, ""Hello"", ""Easy Programming"", etc.||||||string firstName = ""Richard"";|||string lastName = "" Feynman"";||||||C# also supports escape sequence characters such as:|||\xa0|||Character|||Meaning|||\\\'|||Single quote|||\\""|||Double quote|||\\\\|||Backslash|||\\n|||Newline|||\\r|||Carriage return|||\\t|||Horizontal Tab|||\\a|||Alert|||\\b|||Backspace||||||&&&The variable name can contain letters (uppercase and lowercase), underscore( _ ) and digits only.|||The variable name must start with either letter, underscore or @ symbol. For example,|||Rules for naming variables in C#|||Variable Names|||Remarks|||name|||Valid|||subject101|||Valid|||_age|||Valid (Best practice for naming private member variables)|||@break|||Valid (Used if name is a reserved keyword)|||101subject|||Invalid (Starts with digit)|||your_name|||Valid|||your name|||Invalid (Contains whitespace)||||||C# is case sensitive. It means age and Age refers to 2 different variables.|||A variable name must not be a C# keyword. For example, if, for, using can not be a variable name. We will be discussing more about C# keywords in the next tutorial.|||Choose a variable name that make sense. For example, name, age, subject makes more sense than n, a and s.|||Use camelCase notation (starts with lowercase letter) for naming local variables. For example, numberOfStudents, age, etc.|||Use PascalCase or CamelCase (starts with uppercase letter) for naming public member variables. For example, FirstName, Price, etc.|||Use a leading underscore (_) followed by camelCase notation for naming private member variables. For example, _bankBalance, _emailAddress, etc.|||']"
